001:017:002:DESCRIPTOR         1617602495.479309
 05 01 09 80 A1 01 85 01 19 81 29 83 15 00 25 01
 95 03 75 01 81 02 95 01 75 05 81 01 C0 05 0C 09
 01 A1 01 85 02 15 00 25 01 95 12 75 01 0A 83 01
 0A 8A 01 0A 92 01 0A 94 01 09 CD 09 B7 09 B6 09
 B5 09 E2 09 EA 09 E9 0A 21 02 0A 23 02 0A 24 02
 0A 25 02 0A 26 02 0A 27 02 0A 2A 02 81 02 95 01
 75 0E 81 01 C0 05 01 09 06 A1 01 85 04 05 07 95
 01 75 08 81 03 95 E8 75 01 15 00 25 01 05 07 19
 00 29 E7 81 00 C0

001:017:001:DESCRIPTOR         1617602495.479733
 06 00 FF 09 01 A1 01 09 02 15 00 26 FF 00 75 08
 95 40 81 02 09 03 15 00 26 FF 00 75 08 95 40 91
 02 C0

001:017:000:DESCRIPTOR         1617602495.480086
 05 01 09 02 A1 01 09 01 A1 00 05 09 19 01 29 10
 15 00 25 01 75 01 95 10 81 02 05 01 09 30 09 31
 16 01 80 26 FF 7F 75 10 95 02 81 06 09 38 15 81
 25 7F 75 08 95 01 81 06 05 0C 0A 38 02 95 01 81
 06 C0 C0
