005:004:002:DESCRIPTOR         1617489710.244663
 05 01 09 06 A1 01 85 01 05 07 19 E0 29 E7 15 00
 25 01 75 01 95 08 81 02 75 08 95 01 81 01 05 07
 19 00 2A FF 00 15 00 26 FF 00 75 08 95 06 81 00
 C0 05 0C 09 01 A1 01 85 02 05 0C 19 00 2A FF 0F
 15 00 26 FF 0F 75 10 95 02 81 00 C0

005:004:001:DESCRIPTOR         1617489710.245521
 05 01 09 02 A1 01 09 01 A1 00 A1 02 05 09 19 01
 29 08 15 00 25 01 95 08 75 01 81 02 05 01 09 30
 09 31 16 01 80 26 FF 7F 75 10 95 02 81 06 09 38
 15 81 25 7F 75 08 95 01 81 06 C0 A1 02 05 0C 0A
 38 02 15 81 25 7F 75 08 95 01 81 06 C0 A1 02 06
 C1 FF 15 00 26 FF 00 75 08 09 F0 95 02 81 02 C0
 C0 C0

005:004:000:DESCRIPTOR         1617489710.246510
 06 C0 FF 09 01 A1 01 06 C1 FF 15 00 26 FF 00 75
 08 09 F0 95 20 81 02 09 F1 95 20 91 02 09 F2 96
 42 02 B1 02 C0
