001:016:003:DESCRIPTOR         1617602116.719865
 06 00 FF 09 01 A1 01 15 00 26 FF 00 85 01 75 08
 95 15 09 01 B1 02 85 0A 75 08 95 3F 09 01 81 02
 85 0B 75 08 95 3F 09 01 81 02 85 14 75 08 95 0F
 09 01 81 02 85 17 75 08 95 24 09 01 81 02 85 28
 75 08 95 3F 09 01 81 02 85 29 95 3F 09 01 91 02
 85 2A 95 3F 09 01 B1 02 C0

001:016:002:DESCRIPTOR         1617602116.720347
 05 01 09 04 A1 01 75 0C 95 05 15 00 26 FF 0F 35
 00 46 FF 0F 09 30 09 31 09 32 09 35 09 36 81 02
 75 04 95 01 25 07 46 3B 01 65 14 09 39 81 42 95
 20 75 01 15 00 25 01 05 09 19 01 29 20 81 02 C0

001:016:001:DESCRIPTOR         1617602116.720780
 05 01 09 06 A1 01 85 01 75 01 95 08 05 07 19 E0
 29 E7 15 00 25 01 81 02 81 03 95 06 75 08 15 00
 26 FF 00 05 07 19 00 2A FF 00 81 00 C0 05 0C 09
 01 A1 01 85 02 75 10 95 02 15 01 26 9C 02 19 01
 2A 9C 02 81 00 C0

001:016:000:DESCRIPTOR         1617602116.721236
 05 01 09 02 A1 01 85 01 09 01 A1 00 95 10 75 01
 05 09 19 01 29 10 15 00 25 01 81 02 75 10 95 02
 05 01 09 30 09 31 16 01 80 26 FF 7F 81 06 A1 02
 85 02 09 48 95 01 75 02 15 00 25 01 35 01 45 78
 B1 02 85 01 75 10 95 01 09 38 35 00 45 00 16 01
 80 26 FF 7F 81 06 C0 A1 02 85 02 09 48 95 01 75
 02 15 00 25 01 35 01 45 78 B1 02 35 00 45 00 75
 04 B1 03 85 01 75 10 95 01 05 0C 0A 38 02 16 01
 80 26 FF 7F 81 06 C0 C0 C0
